{"$schema":"https://json-schema.org/draft/2020-12/schema","title":"IoT Device Manifest v2","type":"object","required":["schema_version","manifest_id","display_name","model","protocol_version","mqtt"],"properties":{"schema_version":{"const":2},"manifest_id":{"type":"string","pattern":"^[a-z0-9][a-z0-9_.-]*$"},"display_name":{"type":"string","minLength":1},"model":{"type":"string","pattern":"^[a-z0-9][a-z0-9_.-]*$"},"protocol_version":{"type":"integer","minimum":1},"mqtt":{"type":"object","required":["publish","subscribe"],"properties":{"publish":{"type":"array"},"subscribe":{"type":"array"}},"additionalProperties":false}},"additionalProperties":false}
