{"schema_version":2,"manifest_id":"esp32-c3-led","display_name":"ESP32-C3 LED","model":"esp32c3-led","protocol_version":1,"mqtt":{"publish":[{"channel":"state","retained":true,"schema":{"on":{"type":"boolean","required":true},"online":{"type":"boolean","required":true}}},{"channel":"event","events":[{"type":"led.state_changed","payload":{"on":{"type":"boolean","required":true}}}]}],"subscribe":[{"channel":"command","commands":[{"type":"set_led","parameters":{"on":{"type":"boolean","required":true}}}]}]}}
